<?xml version="1.0" encoding="UTF-8"?>
<!DOCTYPE InterFaceMapping PUBLIC  "-//andy.zhou//dynabean desc//ZH" 
"http://git.oschina.net/rjzjh/commons/raw/master/src/main/resources/conf/dynabean.dtd">
<InterFaceMapping>
	<PropertyIn>
		<COL name="single" type="bytes" defaultValue="rjzjh">简单单值</COL>
		<COL name="ary" type="bytes" gtype="array">数组</COL>
		<COL name="map" type="bytes" gtype="map">Map</COL>
		<COL name="list" type="bytes" gtype="list">List</COL>
	</PropertyIn>
	<PropertyOut>
		<COL name="retMsg" type="string" convert="yesorno">返回信息</COL>
	</PropertyOut>
</InterFaceMapping>